{
  "levels": ["Terminale", "MPSI", "MP", "MP*"],
  "cadences": [
    "Blitz · 10 min",
    "Blitz · 15 min",
    "Standard · 15 min",
    "Standard · 20 min",
    "Marathon · 20 min",
    "Marathon · 25 min",
    "Marathon · 30 min",
    "Marathon · 35 min"
  ],
  "difficulties": [
    {"value": 1, "label": "Très facile"},
    {"value": 2, "label": "Facile"},
    {"value": 3, "label": "Intermédiaire"},
    {"value": 4, "label": "Difficile"},
    {"value": 5, "label": "Très difficile"}
  ],
  "chapters": [
    {"n": 1, "name": "Raisonnement et vocabulaire ensembliste", "domain": "Algèbre"},
    {"n": 2, "name": "Compléments de calcul algébrique et de trigonométrie", "domain": "Algèbre"},
    {"n": 3, "name": "Nombres complexes", "domain": "Algèbre"},
    {"n": 4, "name": "Techniques fondamentales de calcul différentiel et intégral", "domain": "Analyse"},
    {"n": 5, "name": "Nombres réels et suites numériques", "domain": "Analyse"},
    {"n": 6, "name": "Fonctions d'une variable réelle : limites, continuité, dérivabilité, convexité", "domain": "Analyse"},
    {"n": 7, "name": "Arithmétique dans Z", "domain": "Algèbre"},
    {"n": 8, "name": "Structures algébriques usuelles", "domain": "Algèbre"},
    {"n": 9, "name": "Calcul matriciel et systèmes linéaires", "domain": "Algèbre"},
    {"n": 10, "name": "Polynômes et fractions rationnelles", "domain": "Algèbre"},
    {"n": 11, "name": "Analyse asymptotique", "domain": "Analyse"},
    {"n": 12, "name": "Espaces vectoriels et applications linéaires", "domain": "Algèbre"},
    {"n": 13, "name": "Matrices", "domain": "Algèbre"},
    {"n": 14, "name": "Groupe symétrique et déterminants", "domain": "Algèbre"},
    {"n": 15, "name": "Intégration", "domain": "Analyse"},
    {"n": 16, "name": "Dénombrement", "domain": "Probabilités"},
    {"n": 17, "name": "Probabilités", "domain": "Probabilités"},
    {"n": 18, "name": "Espaces préhilbertiens réels", "domain": "Algèbre"},
    {"n": 19, "name": "Procédés sommatoires discrets", "domain": "Analyse"},
    {"n": 20, "name": "Fonctions de deux variables", "domain": "Analyse"},
    {"n": 21, "name": "Réduction des endomorphismes et des matrices carrées", "domain": "Algèbre"},
    {"n": 22, "name": "Endomorphismes d'un espace euclidien", "domain": "Algèbre"},
    {"n": 23, "name": "Topologie des espaces vectoriels normés", "domain": "Analyse"},
    {"n": 24, "name": "Séries numériques et vectorielles", "domain": "Analyse"},
    {"n": 25, "name": "Suites et séries de fonctions, séries entières", "domain": "Analyse"},
    {"n": 26, "name": "Fonctions vectorielles", "domain": "Analyse"},
    {"n": 27, "name": "Intégration sur un intervalle quelconque", "domain": "Analyse"},
    {"n": 28, "name": "Variables aléatoires discrètes", "domain": "Probabilités"},
    {"n": 29, "name": "Équations différentielles linéaires", "domain": "Analyse"},
    {"n": 30, "name": "Calcul différentiel et optimisation", "domain": "Analyse"}
  ]
}
